{"id":"devbuddy.database.mongodb.read","runtime":"dotnet","permission_tier":2,"risk":"database-read","scope":{"engine":"mongodb","database_id_required":true,"approval":"target-specific","read_only":true},"input":{"operations":["find","aggregate","count","distinct"],"limits":["max_rows","max_result_bytes","timeout_seconds"]},"output":{"normalized_result":true,"redaction_required":true,"untrusted_data":true}}
