{"id":"devbuddy.database.redis.read","runtime":"dotnet","permission_tier":2,"risk":"database-read","scope":{"engine":"redis","database_id_required":true,"approval":"target-specific","read_only":true,"key_prefix_required":true},"input":{"commands":["GET","MGET","HGET","HMGET","HGETALL","LRANGE","SCARD","SMEMBERS","ZRANGE","TTL","EXISTS","TYPE","STRLEN"],"limits":["max_rows","max_result_bytes","timeout_seconds"]},"output":{"normalized_result":true,"redaction_required":true,"untrusted_data":true}}
